{
  "schemaVersion": "1.0.0",
  "candidate": {
    "candidateId": "synthetic-candidate-001",
    "immutable": true,
    "mediaArtifactId": "candidate-video"
  },
  "provenance": {
    "source": {
      "repository": "https://example.invalid/synthetic/product.git",
      "revision": "synthetic-revision-001",
      "dirty": false
    },
    "build": {
      "buildId": "synthetic-build-001",
      "manifest": {
        "artifactId": "build-manifest",
        "artifactPath": "manifests/build.json",
        "sha256": "1111111111111111111111111111111111111111111111111111111111111111"
      }
    },
    "configuration": {
      "manifest": {
        "artifactId": "configuration-manifest",
        "artifactPath": "manifests/configuration.json",
        "sha256": "2222222222222222222222222222222222222222222222222222222222222222"
      }
    },
    "capture": {
      "captureId": "synthetic-capture-001",
      "command": "playwright synthetic-final-capture",
      "rawCapture": {
        "artifactId": "raw-capture",
        "artifactPath": "source/raw-capture.png",
        "sha256": "1414141414141414141414141414141414141414141414141414141414141414"
      },
      "startedAt": "2026-07-29T14:52:00.000Z",
      "completedAt": "2026-07-29T14:54:00.000Z"
    },
    "render": {
      "renderId": "synthetic-render-001",
      "renderer": "synthetic-frame-renderer",
      "pipelineVersion": "1.0.0",
      "command": "node synthetic/render.mjs --candidate synthetic-candidate-001",
      "environmentManifest": {
        "artifactId": "render-environment",
        "artifactPath": "manifests/render-environment.json",
        "sha256": "3333333333333333333333333333333333333333333333333333333333333333"
      },
      "accelerationManifest": {
        "artifactId": "acceleration-manifest",
        "artifactPath": "manifests/media-acceleration.json",
        "sha256": "1313131313131313131313131313131313131313131313131313131313131313"
      },
      "startedAt": "2026-07-29T14:55:00.000Z",
      "completedAt": "2026-07-29T14:58:00.000Z"
    }
  },
  "artifacts": [
    {"artifactId": "candidate-video", "type": "video", "artifactPath": "candidate/candidate.mp4", "sha256": "aaaaaaaaaaaaaaaaaaaaaaaaaaaaaaaaaaaaaaaaaaaaaaaaaaaaaaaaaaaaaaaa", "mediaType": "video/mp4", "bytes": 1024},
    {"artifactId": "build-manifest", "type": "manifest", "artifactPath": "manifests/build.json", "sha256": "1111111111111111111111111111111111111111111111111111111111111111", "mediaType": "application/json", "bytes": 128},
    {"artifactId": "configuration-manifest", "type": "manifest", "artifactPath": "manifests/configuration.json", "sha256": "2222222222222222222222222222222222222222222222222222222222222222", "mediaType": "application/json", "bytes": 128},
    {"artifactId": "render-environment", "type": "manifest", "artifactPath": "manifests/render-environment.json", "sha256": "3333333333333333333333333333333333333333333333333333333333333333", "mediaType": "application/json", "bytes": 128},
    {"artifactId": "acceleration-manifest", "type": "manifest", "artifactPath": "manifests/media-acceleration.json", "sha256": "1313131313131313131313131313131313131313131313131313131313131313", "mediaType": "application/json", "bytes": 128},
    {"artifactId": "report-media-metadata", "type": "report", "artifactPath": "reports/media-metadata.json", "sha256": "4444444444444444444444444444444444444444444444444444444444444444", "mediaType": "application/json", "bytes": 128},
    {"artifactId": "report-frames-contact-sheets", "type": "report", "artifactPath": "reports/frames-contact-sheets.json", "sha256": "5555555555555555555555555555555555555555555555555555555555555555", "mediaType": "application/json", "bytes": 128},
    {"artifactId": "report-scene-boundaries", "type": "report", "artifactPath": "reports/scene-boundaries.json", "sha256": "6666666666666666666666666666666666666666666666666666666666666666", "mediaType": "application/json", "bytes": 128},
    {"artifactId": "report-frame-integrity", "type": "report", "artifactPath": "reports/frame-integrity.json", "sha256": "7777777777777777777777777777777777777777777777777777777777777777", "mediaType": "application/json", "bytes": 128},
    {"artifactId": "report-audio-quality", "type": "report", "artifactPath": "reports/audio-quality.json", "sha256": "8888888888888888888888888888888888888888888888888888888888888888", "mediaType": "application/json", "bytes": 128},
    {"artifactId": "report-asr-word-timestamps", "type": "report", "artifactPath": "reports/asr-word-timestamps.json", "sha256": "9999999999999999999999999999999999999999999999999999999999999999", "mediaType": "application/json", "bytes": 128},
    {"artifactId": "report-caption-timing-layout", "type": "report", "artifactPath": "reports/caption-timing-layout.json", "sha256": "bbbbbbbbbbbbbbbbbbbbbbbbbbbbbbbbbbbbbbbbbbbbbbbbbbbbbbbbbbbbbbbb", "mediaType": "application/json", "bytes": 128},
    {"artifactId": "report-ocr-visible-text", "type": "report", "artifactPath": "reports/ocr-visible-text.json", "sha256": "cccccccccccccccccccccccccccccccccccccccccccccccccccccccccccccccc", "mediaType": "application/json", "bytes": 128},
    {"artifactId": "report-motion-analysis", "type": "report", "artifactPath": "reports/motion-analysis.json", "sha256": "dddddddddddddddddddddddddddddddddddddddddddddddddddddddddddddddd", "mediaType": "application/json", "bytes": 128},
    {"artifactId": "report-browser-playback", "type": "report", "artifactPath": "reports/browser-playback.json", "sha256": "eeeeeeeeeeeeeeeeeeeeeeeeeeeeeeeeeeeeeeeeeeeeeeeeeeeeeeeeeeeeeeee", "mediaType": "application/json", "bytes": 128},
    {"artifactId": "report-browser-console", "type": "report", "artifactPath": "reports/browser-console.json", "sha256": "ffffffffffffffffffffffffffffffffffffffffffffffffffffffffffffffff", "mediaType": "application/json", "bytes": 128},
    {"artifactId": "report-browser-network", "type": "report", "artifactPath": "reports/browser-network.json", "sha256": "abababababababababababababababababababababababababababababababab", "mediaType": "application/json", "bytes": 128},
    {"artifactId": "report-technical-delivery", "type": "report", "artifactPath": "reports/technical-delivery.json", "sha256": "bcbcbcbcbcbcbcbcbcbcbcbcbcbcbcbcbcbcbcbcbcbcbcbcbcbcbcbcbcbcbcbc", "mediaType": "application/json", "bytes": 128},
    {"artifactId": "report-claim-verification", "type": "report", "artifactPath": "reports/claim-verification.json", "sha256": "cdcdcdcdcdcdcdcdcdcdcdcdcdcdcdcdcdcdcdcdcdcdcdcdcdcdcdcdcdcdcdcd", "mediaType": "application/json", "bytes": 128},
    {"artifactId": "report-truth-sheet", "type": "report", "artifactPath": "reports/truth-sheet.json", "sha256": "dededededededededededededededededededededededededededededededede", "mediaType": "application/json", "bytes": 128},
    {"artifactId": "storyboard", "type": "storyboard", "artifactPath": "source/storyboard.json", "sha256": "1212121212121212121212121212121212121212121212121212121212121212", "mediaType": "application/json", "bytes": 128},
    {"artifactId": "capture-manifest", "type": "capture-manifest", "artifactPath": "source/capture-manifest.json", "sha256": "3434343434343434343434343434343434343434343434343434343434343434", "mediaType": "application/json", "bytes": 128},
    {"artifactId": "raw-capture", "type": "raw-capture", "artifactPath": "source/raw-capture.png", "sha256": "1414141414141414141414141414141414141414141414141414141414141414", "mediaType": "image/png", "bytes": 128},
    {"artifactId": "report-craft-contract", "type": "report", "artifactPath": "reports/craft-contract.json", "sha256": "5656565656565656565656565656565656565656565656565656565656565656", "mediaType": "application/json", "bytes": 128}
  ],
  "reports": {
    "mediaMetadata": {"artifactId": "report-media-metadata", "artifactPath": "reports/media-metadata.json", "sha256": "4444444444444444444444444444444444444444444444444444444444444444", "candidateId": "synthetic-candidate-001", "reportType": "mediaMetadata", "status": "PASS", "generatedAt": "2026-07-29T14:59:00.000Z"},
    "framesAndContactSheets": {"artifactId": "report-frames-contact-sheets", "artifactPath": "reports/frames-contact-sheets.json", "sha256": "5555555555555555555555555555555555555555555555555555555555555555", "candidateId": "synthetic-candidate-001", "reportType": "framesAndContactSheets", "status": "PASS", "generatedAt": "2026-07-29T14:59:00.000Z"},
    "sceneBoundaries": {"artifactId": "report-scene-boundaries", "artifactPath": "reports/scene-boundaries.json", "sha256": "6666666666666666666666666666666666666666666666666666666666666666", "candidateId": "synthetic-candidate-001", "reportType": "sceneBoundaries", "status": "PASS", "generatedAt": "2026-07-29T14:59:00.000Z"},
    "frameIntegrity": {"artifactId": "report-frame-integrity", "artifactPath": "reports/frame-integrity.json", "sha256": "7777777777777777777777777777777777777777777777777777777777777777", "candidateId": "synthetic-candidate-001", "reportType": "frameIntegrity", "status": "PASS", "generatedAt": "2026-07-29T14:59:00.000Z"},
    "audioQuality": {"artifactId": "report-audio-quality", "artifactPath": "reports/audio-quality.json", "sha256": "8888888888888888888888888888888888888888888888888888888888888888", "candidateId": "synthetic-candidate-001", "reportType": "audioQuality", "status": "PASS", "generatedAt": "2026-07-29T14:59:00.000Z"},
    "asrWordTimestamps": {"artifactId": "report-asr-word-timestamps", "artifactPath": "reports/asr-word-timestamps.json", "sha256": "9999999999999999999999999999999999999999999999999999999999999999", "candidateId": "synthetic-candidate-001", "reportType": "asrWordTimestamps", "status": "PASS", "generatedAt": "2026-07-29T14:59:00.000Z"},